ime,img_loc,opis
CHRA/Core Assemblies,/images/img/unmarked/3.jpg,"CHRA (Centralna Hidraulična Rotaciona Asamblia) u turbini integriše kompresorski točak i turbinu. Rotacija točka stvara vakuum, povećava gustinu vazduha,  poboljšavajući sagorevanje. CHRA obezbeđuje podmazivanje, hlađenje i održava pritisak, unapređujući efikasnost i snagu motora. "
Aktuatori i delovi aktuatora,/images/img/unmarked/4.jpg,"Aktuatori i delovi aktuatora u turbini upravljaju pritiskom izduvnih gasova. Aktuator reaguje na promene u uslovima rada, podešava geometriju turbinu i optimizuje performanse. Ovo omogućava bolju kontrolu pritiska vazduha, povećavajući efikasnost i snagu motora."
Nozzle rings,/images/img/unmarked/5.jpg,"Prstenovi dizni u turbini usmeravaju izduvne gasove prema turbini. Njihova pravilna orijentacija omogućava optimizovan protok gasova, poboljšavajući efikasnost i brzinu turbinu. Ovi prstenovi su ključni za maksimalno iskorišćenje energije izduvnih gasova i povećanje snage motora."
Turbine Shaft Wheels,/images/img/unmarked/6.jpg,"Turbinski osovinasti točak u turbini pokreće se izduvnim gasovima. Njegova rotacija pokreće kompresorski točak, omogućavajući usisavanje i kompresiju  vazduha. Ova simbioza povećava efikasnost motora pomoću poboljšane kompresije, što  rezultira većom snagom i performansama vozila."
Compressor Wheels,/images/img/unmarked/7.jpg,"Kompresorski točak u turbini vrši kompresiju svežeg vazduha. Pokreće se rotacijom izduvnih gasova koje usmerava turbine. Ova kompresija povećava gustinu vazduha pre ulaska u motor, optimizujući sagorevanje i pružajući veću snagu i efikasnost motora."
Bearing Housings,/images/img/unmarked/8.jpg,"Kućišta ležajeva u turbini podržavaju i smeštaju ležajeve koji održavaju rotaciju osovine. Ovi ležajevi omogućavaju glatko okretanje točkova, smanjuju trenje i habanje, čime obezbeđuju dugotrajan i pouzdan rad turbinu."
Servisni kompleti,/images/img/unmarked/9.jpg,"Servisni kompleti za turbine sadrže zamenske delove poput brtvi, ležajeva i drugih komponenti. Ovi kompleti omogućavaju održavanje i obnovu turbinu, produžavajući njegov vek trajanja i očuvavajući optimalne performanse."
